{
  "schema_version": 1,
  "listen_host": "127.0.0.1",
  "port": 8787,
  "device_index": 0,
  "model_root": "models/onnx/ppocrv6-tiny",
  "web_root": "www",
  "api_key": "",
  "enable_classifier": true,
  "det_limit_side": 960,
  "worker_threads": 4,
  "max_queued_requests": 32,
  "engine_wait_timeout_ms": 5000,
  "max_request_bytes": 20971520,
  "max_image_pixels": 40000000,
  "max_batch_images": 32,
  "max_batch_total_pixels": 40000000,
  "max_batch_decoded_bytes": 120000000,
  "max_decode_work_bytes": 268435456,
  "logging_enabled": true,
  "access_log_enabled": true,
  "log_dir": "logs",
  "log_max_bytes": 10485760,
  "log_files": 3
}
